Hace mucho tiempo, pero todavía me acuerdo.
Por las noches, alguien se ocupaba en colocar
ordenados chupones de hielo en los aleros
para ver llover desde el pupitre en las horas de sol.
El mundo se revelaba en cualquier caligrafía
de un soso y gastado libro sin fotografías
y casi cualquier pensamiento era un tesoro,
casi cualquier punto en el mapa un rincón en que soñar.
La mañana sabía a leche en polvo en el patio de la escuela
y volver a casa, pateando un bote o jugando a la rayuela,
era regresar al olor de sopa, de madre y de colada.
