Dentro de la hacienda, en el pabellón que años atrás había sido aposento de caballerías y garaje de carromatos, Dorotea se afanaba en la pila de lavar, 
rascando con el cepillo de raíces los cuellos y puños sobados de las camisas del viejo. Los recios muros del galpón, encalados por su cara exterior, 
devolvían al aire la ardentía y procuraban en el interior una temperatura soportable. La mujer vestía un guardapolvos ligero que contenía apenas sus tetas abundantes, 
que amenazaban con hacer estallar las abotonaduras. La penumbra entre las paredes de piedra y barro convertía aquella estancia en un oasis contra el que se estrellaba la ferocidad de la media tarde. 
La radio tocaba una chacarera, amenizada por las pitadas y la algarabía de una docena de pájaros agradecidos por la sombra y la humedad reconfortante del jacal: 
“Déjenlo a mi corazón / que siga contento y nada más / déjenlo que cante alegre / no quiero que tenga algún pesar …”
